{
  "$schema": "https://json-schema.org/draft/2020-12/schema",
  "$id": "https://local.invalid/research-kb/spec/audit-event.schema.json",
  "type": "object",
  "additionalProperties": false,
  "properties": {
    "schema_version": {
      "const": "1.1.0"
    },
    "event_id": {
      "type": "string",
      "minLength": 1
    },
    "timestamp": {
      "type": "string",
      "format": "date-time"
    },
    "job_id": {
      "type": [
        "string",
        "null"
      ]
    },
    "operation": {
      "type": "string",
      "minLength": 1
    },
    "description": {
      "type": "string",
      "minLength": 1
    },
    "actor": {
      "type": "string",
      "minLength": 1
    },
    "project": {
      "type": "string",
      "minLength": 1,
      "description": "Optional. The calling project folder, as the launcher passed it (KB_PROJECT)."
    },
    "agent": {
      "type": "string",
      "minLength": 1,
      "description": "Optional. The agent the engine worked for (KB_ACTOR), or unspecified."
    },
    "record_refs": {
      "type": "array",
      "items": {
        "type": "object",
        "additionalProperties": false,
        "properties": {
          "id": {
            "type": "string",
            "pattern": "^[a-z][a-z0-9_-]*:[a-z0-9][a-z0-9_-]*$"
          },
          "revision": {
            "type": "integer",
            "minimum": 1
          }
        },
        "required": [
          "id",
          "revision"
        ]
      },
      "minItems": 0
    },
    "before_release": {
      "type": [
        "string",
        "null"
      ]
    },
    "after_release": {
      "type": [
        "string",
        "null"
      ]
    },
    "outcome": {
      "enum": [
        "prepared",
        "committed",
        "failed",
        "cancelled",
        "redacted"
      ]
    },
    "reason": {
      "type": "string",
      "minLength": 1
    }
  },
  "required": [
    "schema_version",
    "event_id",
    "timestamp",
    "job_id",
    "operation",
    "description",
    "actor",
    "record_refs",
    "before_release",
    "after_release",
    "outcome",
    "reason"
  ]
}
